{
  "schema_version": "ladybug_projection_build_receipt_v1",
  "capsule_id": "cap_conflict_situation_fixture_v3",
  "profile": "ladybug_projection_v1",
  "built_at_unix_seconds": 1780943543,
  "source_graph_digest": "sha256:f28a32eceba22140f2e14a19508e4bd8ad7a38c262fe9baa6efea9f1c11c3208",
  "projection_digest": "sha256:8ee639b5cec225f95127ab60250fc611fdc60e90b61a9214b5a495177ffd8ea3",
  "node_count": 9,
  "edge_count": 3,
  "query_check": "build_completed"
}
